"OperationType","Title","PublicationDate","Guid","Description","DescriptionIsParsable","QuickDescription","Notes","SubChanges"
"Adding","Skype for Business Online","3/29/2016 12:55:12 PM","19fe8106-efa2-404c-bc40-2afe6018ef91","Adding 24 New IP_Sets; 1/[Effective 5/1/2016. Required: Skype for Business. ER: Yes. Port: TCP 443. 131.253.145.128/25], 2/[Effective 5/1/2016. Required: Skype for Business. ER: Yes. Port: TCP 443. 131.253.166.192/26], 3/[Effective 5/1/2016. Required: Skype for Business. ER: Yes. Port: TCP 443. 131.253.145.0/25], 4/[Effective 5/1/2016. Required: Skype for Business. ER: Yes. Port: TCP 443. 131.253.166.128/26], 5/[Effective 5/1/2016. Required: Skype for Business. ER: Yes. Port: TCP 443. 131.253.137.128/25], 6/[Effective 5/1/2016. Required: Skype for Business. ER: Yes. Port: TCP 443. 131.253.163.128/26], 7/[Effective 5/1/2016. Required: Skype for Business. ER: Yes. Port: TCP 443. 131.253.138.0/25], 8/[Effective 5/1/2016. Required: Skype for Business. ER: Yes. Port: TCP 443. 131.253.163.192/26], 9/[Effective 5/1/2016. Required: Skype for Business. ER: Yes. Port: TCP 443. 131.253.164.192/26], 10/[Effective 5/1/2016. Required: Skype for Business. ER: Yes. Port: TCP 443. 131.253.139.128/25], 11/[Effective 5/1/2016. Required: Skype for Business. ER: Yes. Port: TCP 443. 131.253.144.128/25], 12/[Effective 5/1/2016. Required: Skype for Business. ER: Yes. Port: TCP 443. 131.253.166.64/26], 13/[Effective 5/1/2016. Required: Skype for Business. ER: No. Port: TCP 443. 2a01:111:2047:2::/64], 14/[Effective 5/1/2016. Required: Skype for Business. ER: No. Port: TCP 443. 2a01:111:2047:1::/64], 15/[Effective 5/1/2016. Required: Skype for Business. ER: No. Port: TCP 443. 2a01:111:2048:2::/64], 16/[Effective 5/1/2016. Required: Skype for Business. ER: No. Port: TCP 443. 2a01:111:2048:1::/64], 17/[Effective 5/1/2016. Required: Skype for Business. ER: No. Port: TCP 443. 2a01:111:f406:3406::/64], 18/[Effective 5/1/2016. Required: Skype for Business. ER: No. Port: TCP 443. 2a01:111:f406:3405::/64], 19/[Effective 5/1/2016. Required: Skype for Business. ER: No. Port: TCP 443. 2a01:111:200f:11::/64], 20/[Effective 5/1/2016. Required: Skype for Business. ER: No. Port: TCP 443. 2a01:111:200f:10::/64], 21/[Effective 5/1/2016. Required: Skype for Business. ER: Yes. Port: TCP 443. 13.107.8.0/24], 22/[Effective 5/1/2016. Required: Skype for Business. ER: Yes. Port: TCP 443. 104.44.195.0/24], 23/[Effective 5/1/2016. Required: Skype for Business. ER: Yes. Port: TCP 443. 104.44.200.0/24], 24/[Effective 5/1/2016. Required: Skype for Business. ER: Yes. Port: TCP 443. 104.44.201.0/24]. Notes: Adding additional endpoints required for SFB.","True","Adding 24 New IP_Sets","Adding additional endpoints required for SFB.",""
"Adding","Exchange Online","3/29/2016 7:44:28 PM","afe6017e-f910-45df-b303-bfd5019fe710","Adding 7 New IP_Sets; 1/[Effective 5/1/2016. Required: Exchange Online. ER: Yes. Port: TCP 80 & 443. 157.56.24.0/25], 2/[Effective 5/1/2016. Required: Exchange Online. ER: Yes. Port: TCP 80 & 443. 157.56.96.16/28], 3/[Effective 5/1/2016. Required: Exchange Online. ER: Yes. Port: TCP 80 & 443. 157.56.96.224/29], 4/[Effective 5/1/2016. Required: Exchange Online. ER: Yes. Port: TCP 80 & 443. 157.56.96.232/29], 5/[Effective 5/1/2016. Required: Exchange Online. ER: Yes. Port: TCP 80 & 443. 157.56.106.128/28], 6/[Effective 5/1/2016. Required: Exchange Online. ER: Yes. Port: TCP 80 & 443. 157.56.232.0/21], 7/[Effective 5/1/2016. Required: Exchange Online. ER: Yes. Port: TCP 80 & 443. 157.56.240.0/20]. Notes: Adding more specific subnets.","True","Adding 7 New IP_Sets","Adding more specific subnets.",""
"Adding","Skype for Business Online","4/1/2016 1:30:52 PM","8106dfa3-04cf-4c40-a9fe-7017ef9205df","Adding 2 New IP_Sets; 1/[Effective 5/1/2016. Required: Skype for Business. ER: Yes. 131.253.128.0/19], 2/[Effective 5/1/2016. Required: Skype for Business. ER: Yes. 131.253.160.0/20]. Notes: Adding additional endpoints required for SfB. These two larger ranges will replace a significant portion of the smaller subnets previously listed.","True","Adding 2 New IP_Sets","Adding additional endpoints required for SfB. These two larger ranges will replace a significant portion of the smaller subnets previously listed.",""
,"Office 365 endpoint XML","4/1/2016 1:30:52 PM","c8780112-60d2-4b59-8181-9ce7b39d20b2","The XML file is generating appropriately and matchesĂ‚Â theĂ‚Â webpage (https://support.office.com/article/Office-365-URLs-and-IP-address-ranges-8548a211-3fe7-47cb-abb1-355ea5aa88a2) which is currently the source of record.","False",,,
"Adding","Office Online","4/5/2016 6:27:42 PM","5b855744-64ce-4788-887d-64c4aab79946","Adding 19 New IP_Sets; 1/[Effective 4/7/2016. Required: Office Online. ER: Yes. Port: TCP 443. 13.69.187.20], 2/[Effective 4/7/2016. Required: Office Online. ER: Yes. Port: TCP 443. 13.92.126.26], 3/[Effective 4/7/2016. Required: Office Online. ER: Yes. Port: TCP 443. 23.103.183.15], 4/[Effective 4/7/2016. Required: Office Online. ER: Yes. Port: TCP 443. 40.112.215.106], 5/[Effective 4/7/2016. Required: Office Online. ER: Yes. Port: TCP 443. 40.121.80.219], 6/[Effective 4/7/2016. Required: Office Online. ER: Yes. Port: TCP 443. 104.40.225.204], 7/[Effective 4/7/2016. Required: Office Online. ER: Yes. Port: TCP 443. 104.214.38.136], 8/[Effective 4/7/2016. Required: Office Online. ER: Yes. Port: TCP 443. 134.170.27.86], 9/[Effective 4/7/2016. Required: Office Online. ER: Yes. Port: TCP 443. 134.170.48.20], 10/[Effective 4/7/2016. Required: Office Online. ER: Yes. Port: TCP 443. 134.170.48.22], 11/[Effective 4/7/2016. Required: Office Online. ER: Yes. Port: TCP 443. 134.170.65.86], 12/[Effective 4/7/2016. Required: Office Online. ER: Yes. Port: TCP 443. 134.170.170.86], 13/[Effective 4/7/2016. Required: Office Online. ER: Yes. Port: TCP 443. 168.63.99.250], 14/[Effective 4/7/2016. Required: Office Online. ER: Yes. Port: TCP 443. 40.126.236.216], 15/[Effective 4/7/2016. Required: Office Online. ER: Yes. Port: TCP 443. 40.127.79.139], 16/[Effective 4/7/2016. Required: Office Online. ER: Yes. Port: TCP 443. 104.211.103.207], 17/[Effective 4/7/2016. Required: Office Online. ER: Yes. Port: TCP 443. 104.211.229.230], 18/[Effective 4/7/2016. Required: Office Online. ER: Yes. Port: TCP 443. 40.74.130.243], 19/[Effective 4/7/2016. Required: Office Online. ER: Yes. Port: TCP 443. 13.71.155.176]. Notes: Adding additional IP addresses required for Office Online. Some of these IP addresses are included in larger ranges previously published, those ranges will soon be removed leaving just these endpoints for Office Online.","True","Adding 19 New IP_Sets",,""
"Removing","Office Online","4/5/2016 6:27:42 PM","cb6df7e7-9ddb-49eb-a229-2967d0f506e7","Removing 4 Old IP_Sets; 1/[Effective 4/7/2016. Required: Office Online. ER: Yes. Port: TCP 443. 23.102.157.61], 2/[Effective 4/7/2016. Required: Office Online. ER: Yes. Port: TCP 443. 104.215.194.17], 3/[Effective 4/7/2016. Required: Office Online. ER: Yes. Port: TCP 443. 204.79.197.204], 4/[Effective 4/7/2016. Required: Office Online. ER: Yes. Port: TCP 443. 204.79.197.205]. Notes: remove at your convenience, no longer used for Office Online.","True","Removing 4 Old IP_Sets",,""
"InfoONly","Office 365","4/8/2016 5:19:54 PM","ef8105df-b303-4bfd-9029-fe7107efa204","Notes: Clarifying some Exchange Hybrid Configuration Wizard and Azure RMS endpoints may be available over the Azure Public routing domain. Also adding a reference to the Office 365 Import Service.","True","Information - read description",,""
"InfoONly","SharePoint Online","4/8/2016 5:19:54 PM","5cfb403a-fd60-418e-b810-6dfa304bfc50","Notes: Clarifying SPO ranges availability over ExpressRoute. The IP address ranges reported on 3/29 for SPO are now available over both the Internet and ExpressRoute. Previously a portion of the endpoints were only available over the Internet. Also clarified the CIDR formatting for the two unchanged rangesĂ‚Â 13.107.6.150-151 & 13.107.9.150-151.","True","Information - read description",,""
"Adding","Office 365 portal and shared","4/14/2016 12:48:53 PM","8e272aa8-da64-4453-8ce3-a78011351710","Adding 1 New FQDNs; 1/[Effective 4/14/2016. Required: Office 365 Portal. ER: No. Port: TCP 443. portal.microsoftonline.com]. Notes: This legacy FQDN redirects to portal.office.com. This FQDN will be removed soon.","True","Adding 1 New FQDNs","This legacy FQDN redirects to portal.office.com. This FQDN will be removed soon.",""
"Adding","Skype for Business Online","4/14/2016 12:48:53 PM","a41a3d57-f9eb-4cda-988b-decc6f75aace","Adding 3 New FQDNs; 1/[Effective 4/14/2016. Optional: Federation with Skype and public IM connectivity: Contact picture retrieval. ER: No. Port: TCP 443. *.api.skype.com], 2/[Effective 4/14/2016. Optional: Federation with Skype and public IM connectivity: Contact picture retrieval. ER: No. Port: TCP 443. *.users.storage.live.com], 3/[Effective 4/14/2016. Optional: Federation with Skype and public IM connectivity: Skype Search. ER: No. Port: TCP 80. Graph.skype.com]. Notes: optional FQDNs to support federation with skype and public IM connectivity. If youĂ˘â‚¬â„˘re not using this feature, enabled by enabling the public IM connectivity feature in the Skype for Business Online admin interface, you do not need to be able to reach these FQDNs. The wildcards represent unique identifiers.","True","Adding 3 New FQDNs",,""
,"Office 365 ProPlus","4/20/2016 7:08:01 PM","04cfc402-afd6-4018-af81-06dfb303bfd5","Adding 2 New FQDNs; 1/[Effective 4/8/2016. Required: Office 365 ProPlus download. ER: No. Port: TCP 80 &amp; 443. officecdn.microsoft.com.edgesuite.net], 2/[Effective 4/8/2016. Required: Office 365 ProPlus download. ER: No. Port: TCP 80 &amp; 443. officecdn.microsoft.com.edgekey.net]. Notes: Clarifying, these were added previously and the RSS entry was removed during troubleshooting of the RSS feed GUID problem. Adding it back to ensure all entries are logged here.","False",,,
"Adding","Office 365 ProPlus","4/20/2016 7:08:01 PM","fd6018ef-8106-4dfa-b04b-fc5029fe7007","Adding 1 New FQDNs; 1/[Effective 4/22/2016. Required: Office 365 shared infrastructure. ER: No. Port: TCP 443. officeclient.microsoft.com]. Notes: runtime client configuration for Office 365 ProPlus.","True","Adding 1 New FQDNs","runtime client configuration for Office 365 ProPlus.",""
"InfoONly","SharePoint Online","4/20/2016 7:08:01 PM","dfb303bf-d502-49fe-b107-efa204cfc402","Notes: Clarifying Port 80 is required for row four and five.","True","Information - read description",,""
"Adding","Office 365 Portal and shared","4/20/2016 7:08:01 PM","304cfc40-29fe-4701-bef9-205dfb303bfd","Adding 7 New FQDNs; 1/[Effective 5/22/2016. Optional: Office 365 shared infrastructure. ER: No. Port: TCP 443. nexusrules.officeapps.live.com], 2/[Effective 5/22/2016. Optional: Cloud App Security. ER: No. Port: TCP 443. *.Portal.cloudappsecurity.com], 3/[Effective 5/22/2016. Optional: Security and Compliance export. ER: No. Port: TCP 443. protection.office.com], 4/[Effective 5/22/2016. Optional: Security and Compliance export. ER: No. Port: TCP 443. *.blob.core.windows.net], 5/[Effective 5/22/2016. Optional: Security and Compliance export. ER: No. Port: TCP 443. office365zoom.cloudapp.net], 6/[Effective 5/22/2016. Optional: Security and Compliance export. ER: No. Port: TCP 443. equivioprod*.cloudapp.net], 7/[Effective 5/22/2016. Optional: Security and Compliance export. ER: No. Port: TCP 443. zoom-cs-prod*.cloudapp.net]. Notes: Additional FQDN for the shared infrastructure, cloud app security, and compliance exports.","True","Adding 7 New FQDNs",,""
"Adding","Office 365 Portal and shared","4/20/2016 7:08:01 PM","cfc402af-e701-47ef-9205-dfb303bfd501","Adding 3 New IP_Sets; 1/[Effective 5/22/2016. Optional: Cloud App Security. ER: No. Port: TCP 443. 104.42.231.28], 1/[Effective 5/22/2016. Optional: Cloud App Security. ER: No. Port: TCP 443. 104.209.35.177], 1/[Effective 5/22/2016. Optional: Cloud App Security. ER: No. Port: TCP 443. 13.91.98.185]. Notes: Additional IP addresses for Cloud App Security.","True","Adding 3 New IP_Sets","Additional IP addresses for Cloud App Security.",""
"InfoONly","Office 365 endpoints rss feed","4/20/2016 7:08:01 PM","fd5019fe-8106-4efa-a04c-fc402afe6017","Notes: The RSS feed generation is duplicating GUIDs, some RSS readers aren't reporting new entries as a result. This is currently under investigation and the RSS feed will be updated after resolution.","True","Information - read description",,""
"Adding","Office Online","4/29/2016 5:53:13 PM","4cfc402a-fd60-418e-b810-6dfb303bfd50","Adding 2 New IP_Sets; 1/[Effective 5/1/2016. Required: Office Online. ER: Yes. Port: TCP 443. 40.76.54.124],2/[Effective 5/1/2016. Required: Office Online. ER: Yes. Port: TCP 443. 104.215.194.17]. Notes: Adding two IP addresses that are effective 5/1.","True","Adding 2 New IP_Sets","Adding two IP addresses that are effective 5/1.",""
"Removing","Office Online","4/29/2016 5:53:14 PM","fa304bfc-5029-4fe7-907e-f9205cfb403a","Removing 8 Old IP_Sets; 1/[Effective 6/1/2016. Required: Office Online. ER: Yes. Port: TCP 443. 13.92.126.26], 2/[Effective 6/1/2016. Required: Office Online. ER: Yes. Port: TCP 443. 23.103.183.0/26], 3/[Effective 6/1/2016. Required: Office Online. ER: Yes. Port: TCP 443. 40.112.215.106], 4/[Effective 6/1/2016. Required: Office Online. ER: Yes. Port: TCP 443. 40.121.80.219], 5/[Effective 6/1/2016. Required: Office Online. ER: Yes. Port: TCP 443. 134.170.27.64/26], 6/[Effective 6/1/2016. Required: Office Online. ER: Yes. Port: TCP 443. 134.170.48.0/26], 7/[Effective 6/1/2016. Required: Office Online. ER: Yes. Port: TCP 443. 134.170.65.64/26], 8/[Effective 6/1/2016. Required: Office Online. ER: Yes. Port: TCP 443. 134.170.170.64/26]. Notes: removing endpoints that are no longer in use by Office Online, remove at your earliest convenience.","True","Removing 8 Old IP_Sets",,""
"Removing","Office 365 Portal and Shared","4/29/2016 5:53:15 PM","205cfb40-3afd-4601-8ef8-106dfa304bfc","Removing 2 Old IP_Sets; 1/[Effective 6/1/2016. Required: Portal and Shared. ER: Yes. Port: TCP 443. 134.170.0.0/16], 2/[Effective 6/1/2016. Required: Portal and Shared. ER: Yes. Port: TCP 443. 111.221.16.0/21]. Notes: These two large ranges are no longer required for portal and shared. There are smaller ranges within 134.170.0.0/16 that have been added over the last six months and advertised on Azure ExpressRoute. It is recommended that you validate your rules include these smaller ranges as appropriate before removing at your convenience.","True","Removing 2 Old IP_Sets","These two large ranges are no longer required for portal and shared. There are smaller ranges within 134.170.0.0/16 that have been added over the last six months and advertised on Azure ExpressRoute. It is recommended that you validate your rules include these smaller ranges as appropriate before removing at your convenience.",""
"Removing","Office 365 Authentication and identity","4/29/2016 5:52:16 PM","f9205cfb-303b-4fd6-818f-e8106dfa204c","Removing 3 Old IP_Sets; 1/[Effective 6/1/2016. Required: Authentication and identity. ER: Yes. Port: TCP 443. 157.56.0.0/16], 2/[Effective 6/1/2016. Required: Authentication and identity. ER: Yes. Port: TCP 443. 191.234.6.0/24], 3/[Effective 6/1/2016. Required: Authentication and identity. ER: Yes. Port: TCP 443. 132.245.0.0/16]. Notes: These two large ranges are no longer required for portal and shared. There are smaller ranges within both of these subnets that have been added over the last six months and advertised on Azure ExpressRoute. It is recommended that you validate your rules include these smaller ranges as appropriate before removing at your convenience.","True","Removing 3 Old IP_Sets","These two large ranges are no longer required for portal and shared. There are smaller ranges within both of these subnets that have been added over the last six months and advertised on Azure ExpressRoute. It is recommended that you validate your rules include these smaller ranges as appropriate before removing at your convenience.",""
"InfoONly","Skype for Business Online","4/29/2016 5:52:17 PM","c402afe6-017e-4f92-85df-b303bfd5019f","Note: Effective 6/1/2016 - Adding UDP 3479, 3480, & 3481 to rows 6, 7, & 8 of the Skype for Business online section. These additional ports will be required to accommodate improvements to Audio, Video, and Desktop sharing.","True","Information - read description",,""
"Removing","Skype for Business Online","4/29/2016 5:52:18 PM","02afe701-7ef9-4205-9fb3-03bfd5018fe8","Removing 48 Old IP_Sets; 1/[Effective 6/1/2016. Required: Skype for Business Online. ER: Yes. Port: TCP 443. 131.253.128.128/25], 2/[Effective 6/1/2016. Required: Skype for Business Online. ER: Yes. Port: TCP 443. 131.253.129.0/25], 3/[Effective 6/1/2016. Required: Skype for Business Online. ER: Yes. Port: TCP 443. 131.253.129.128/26], 4/[Effective 6/1/2016. Required: Skype for Business Online. ER: Yes. Port: TCP 443. 131.253.129.143], 5/[Effective 6/1/2016. Required: Skype for Business Online. ER: Yes. Port: TCP 443. 131.253.130.0/25], 6/[Effective 6/1/2016. Required: Skype for Business Online. ER: Yes. Port: TCP 443. 131.253.130.128/26], 7/[Effective 6/1/2016. Required: Skype for Business Online. ER: Yes. Port: TCP 443. 131.253.130.192/26], 8/[Effective 6/1/2016. Required: Skype for Business Online. ER: Yes. Port: TCP 443. 131.253.131.0/25], 9/[Effective 6/1/2016. Required: Skype for Business Online. ER: Yes. Port: TCP 443. 131.253.131.128/26], 10/[Effective 6/1/2016. Required: Skype for Business Online. ER: Yes. Port: TCP 443. 131.253.132.0/25], 11/[Effective 6/1/2016. Required: Skype for Business Online. ER: Yes. Port: TCP 443. 131.253.133.0/25], 12/[Effective 6/1/2016. Required: Skype for Business Online. ER: Yes. Port: TCP 443. 131.253.134.0/25], 13/[Effective 6/1/2016. Required: Skype for Business Online. ER: Yes. Port: TCP 443. 131.253.134.128/25], 14/[Effective 6/1/2016. Required: Skype for Business Online. ER: Yes. Port: TCP 443. 131.253.135.128/25], 15/[Effective 6/1/2016. Required: Skype for Business Online. ER: Yes. Port: TCP 443. 131.253.136.0/25], 16/[Effective 6/1/2016. Required: Skype for Business Online. ER: Yes. Port: TCP 443. 131.253.136.128/25], 17/[Effective 6/1/2016. Required: Skype for Business Online. ER: Yes. Port: TCP 443. 131.253.137.0/25], 18/[Effective 6/1/2016. Required: Skype for Business Online. ER: Yes. Port: TCP 443. 131.253.137.128/25], 19/[Effective 6/1/2016. Required: Skype for Business Online. ER: Yes. Port: TCP 443. 131.253.138.0/25], 20/[Effective 6/1/2016. Required: Skype for Business Online. ER: Yes. Port: TCP 443. 131.253.138.128/25], 21/[Effective 6/1/2016. Required: Skype for Business Online. ER: Yes. Port: TCP 443. 131.253.139.128/25], 22/[Effective 6/1/2016. Required: Skype for Business Online. ER: Yes. Port: TCP 443. 131.253.140.0/25], 23/[Effective 6/1/2016. Required: Skype for Business Online. ER: Yes. Port: TCP 443. 131.253.140.128/25], 24/[Effective 6/1/2016. Required: Skype for Business Online. ER: Yes. Port: TCP 443. 131.253.141.0/25], 25/[Effective 6/1/2016. Required: Skype for Business Online. ER: Yes. Port: TCP 443. 131.253.141.128/25], 26/[Effective 6/1/2016. Required: Skype for Business Online. ER: Yes. Port: TCP 443. 131.253.142.128/25], 27/[Effective 6/1/2016. Required: Skype for Business Online. ER: Yes. Port: TCP 443. 131.253.144.128/25], 28/[Effective 6/1/2016. Required: Skype for Business Online. ER: Yes. Port: TCP 443. 131.253.145.0/25], 29/[Effective 6/1/2016. Required: Skype for Business Online. ER: Yes. Port: TCP 443. 131.253.145.128/25], 30/[Effective 6/1/2016. Required: Skype for Business Online. ER: Yes. Port: TCP 443. 131.253.160.0/26], 31/[Effective 6/1/2016. Required: Skype for Business Online. ER: Yes. Port: TCP 443. 131.253.160.128/26], 32/[Effective 6/1/2016. Required: Skype for Business Online. ER: Yes. Port: TCP 443. 131.253.160.64/26], 33/[Effective 6/1/2016. Required: Skype for Business Online. ER: Yes. Port: TCP 443. 131.253.161.128/26], 34/[Effective 6/1/2016. Required: Skype for Business Online. ER: Yes. Port: TCP 443. 131.253.161.192/26], 35/[Effective 6/1/2016. Required: Skype for Business Online. ER: Yes. Port: TCP 443. 131.253.162.0/26], 36/[Effective 6/1/2016. Required: Skype for Business Online. ER: Yes. Port: TCP 443. 131.253.162.128/26], 37/[Effective 6/1/2016. Required: Skype for Business Online. ER: Yes. Port: TCP 443. 131.253.162.192/26], 38/[Effective 6/1/2016. Required: Skype for Business Online. ER: Yes. Port: TCP 443. 131.253.162.64/26], 39/[Effective 6/1/2016. Required: Skype for Business Online. ER: Yes. Port: TCP 443. 131.253.163.0/26], 40/[Effective 6/1/2016. Required: Skype for Business Online. ER: Yes. Port: TCP 443. 131.253.163.128/26], 41/[Effective 6/1/2016. Required: Skype for Business Online. ER: Yes. Port: TCP 443. 131.253.163.192/26], 42/[Effective 6/1/2016. Required: Skype for Business Online. ER: Yes. Port: TCP 443. 131.253.163.64/26], 43/[Effective 6/1/2016. Required: Skype for Business Online. ER: Yes. Port: TCP 443. 131.253.164.0/26], 44/[Effective 6/1/2016. Required: Skype for Business Online. ER: Yes. Port: TCP 443. 131.253.164.192/26], 45/[Effective 6/1/2016. Required: Skype for Business Online. ER: Yes. Port: TCP 443. 131.253.165.0/26], 46/[Effective 6/1/2016. Required: Skype for Business Online. ER: Yes. Port: TCP 443. 131.253.166.128/26], 47/[Effective 6/1/2016. Required: Skype for Business Online. ER: Yes. Port: TCP 443. 131.253.166.192/26], 48/[Effective 6/1/2016. Required: Skype for Business Online. ER: Yes. Port: TCP 443. 131.253.166.64/26]. Notes: These IP ranges were consolidated to 131.253.128.0/19 & 131.253.160.0/20 on March 29, 2016. Since that time, the consolidated ranges have been advertised via Azure ExpressRoute. As a result we are removing the smaller ranges. You can safely remove them at your convenience.","True","Removing 48 Old IP_Sets",,""
"Removing","Exchange Online","4/29/2016 5:52:19 PM","d5019fe8-106e-4fa2-84cf-c402afe6018e","Removing 5 Old IP_Sets; 1/[Effective 6/1/2016. Required: Exchange Online. ER: Yes. Port: TCP 443. 157.56.0.0/16], 2/[Effective 6/1/2016. Required: Exchange Online. ER: Yes. Port: TCP 443. 111.221.23.128/25], 3/[Effective 6/1/2016. Required: Exchange Online. ER: Yes. Port: TCP 443. 111.221.66.0/25], 4/[Effective 6/1/2016. Required: Exchange Online. ER: Yes. Port: TCP 443. 111.221.69.128/25], 5/[Effective 6/1/2016. Required: Exchange Online. ER: Yes. Port: TCP 443. 111.221.112.0/21]. Notes: These IP ranges have either been replaced by a more specific subset, been consolidated, or have had the infrastructure associated with them decommissioned. The smaller and consolidated subnets (157.56.24.0/25, 157.56.96.16/28, 157.56.96.224/29, 157.56.96.232/29, 157.56.106.128/28, 157.56.232.0/21, 157.56.240.0/20) were added in March. Since that time, the ranges have been advertised via Azure ExpressRoute. As a result, we are removing these ranges. You can safely remove them at your convenience.","True","Removing 5 Old IP_Sets",,""
"Adding","OneNote","5/3/2016 11:25:45 AM","fc5029fe-7107-4ef9-a05c-fb403afd6018","Adding 16 New IP_Sets; 1/[Effective 6/1/2016. Optional: Required for OneNote notebooks. ER: No. Port: TCP 443. 13.73.106.160], 2/[Effective 6/1/2016. Optional: Required for OneNote notebooks. ER: No. Port: TCP 443. 13.73.117.164], 3/[Effective 6/1/2016. Optional: Required for OneNote notebooks. ER: No. Port: TCP 443. 13.75.158.234], 4/[Effective 6/1/2016. Optional: Required for OneNote notebooks. ER: No. Port: TCP 443. 13.78.58.132], 5/[Effective 6/1/2016. Optional: Required for OneNote notebooks. ER: No. Port: TCP 443. 13.79.161.29], 6/[Effective 6/1/2016. Optional: Required for OneNote notebooks. ER: No. Port: TCP 443. 23.99.92.12], 7/[Effective 6/1/2016. Optional: Required for OneNote notebooks. ER: No. Port: TCP 443. 23.101.62.52], 8/[Effective 6/1/2016. Optional: Required for OneNote notebooks. ER: No. Port: TCP 443. 40.74.119.255], 9/[Effective 6/1/2016. Optional: Required for OneNote notebooks. ER: No. Port: TCP 443. 40.74.129.10], 10/[Effective 6/1/2016. Optional: Required for OneNote notebooks. ER: No. Port: TCP 443. 40.115.251.30], 11/[Effective 6/1/2016. Optional: Required for OneNote notebooks. ER: No. Port: TCP 443. 40.117.40.63], 12/[Effective 6/1/2016. Optional: Required for OneNote notebooks. ER: No. Port: TCP 443. 40.118.97.54], 13/[Effective 6/1/2016. Optional: Required for OneNote notebooks. ER: No. Port: TCP 443. 40.126.226.14], 14/[Effective 6/1/2016. Optional: Required for OneNote notebooks. ER: No. Port: TCP 443. 52.160.98.52], 15/[Effective 6/1/2016. Optional: Required for OneNote notebooks. ER: No. Port: TCP 443. 104.40.218.86], 16/[Effective 6/1/2016. Optional: Required for OneNote notebooks. ER: No. Port: TCP 443. 104.209.130.88]. Notes: Adding new IP addresses that represent new capacity for OneNote notebooks.","True","Adding 16 New IP_Sets","Adding new IP addresses that represent new capacity for OneNote notebooks.",""
